{
  "standard": "EIGIIB-E16-A5-CLOSURE-1.0",
  "status": "final-frozen-closure",
  "final_state": "closed",
  "profile_revision": "EIGIIB-E16-1.0",
  "source_e16_a4_commit": "b28fe74f829141232770155724620617bfb1241c",
  "historical_replay_tool": "tools/eigiib_historical_e16_a4_replay.py",
  "matrix_catalog": "conformance/e16-a5-verifier-matrix.json",
  "matrix_runner": "tools/eigiib_e16_verifier_matrix.py",
  "reference_verifier": "tools/eigiib_e16_preservation_reference.py",
  "independent_verifier": "tools/eigiib_e16_preservation_independent.py",
  "authority_manifest": "conformance/e16-a5-authority-manifest.json",
  "authority_freeze": "conformance/e16-a5-authority-freeze.json",
  "expected_case_count": 20,
  "expected_verifier_count": 2,
  "expected_authority_count": 95,
  "nonclaims": [
    "physical-custody-transfer",
    "legal-custody-or-ownership",
    "physical-replica-independence",
    "real-verifier-independence",
    "continuous-retention",
    "indefinite-durability",
    "globally-trusted-time",
    "complete-loss-detection",
    "complete-quarantine-enforcement",
    "future-restore-success",
    "external-service-honesty",
    "collusion-resistance",
    "universal-verifier-correctness",
    "universal-availability",
    "universal-interoperability",
    "external-durability-of-final-freeze"
  ]
}
